{
  "contractId": "mode-chipbar-v1",
  "componentId": "mode-chipbar",
  "version": "1.0.0",
  "scenarioRefs": ["@SCN-MODE-001", "@SCN-MODE-002", "@SCN-MODE-003"],
  "states": [
    { "id": "visible", "default": true }
  ],
  "events": [
    { "name": "select_mode", "result": "request_mode_transition" },
    { "name": "transition_rejected", "result": "show_guidance_keep_previous_state" }
  ],
  "outputs": [
    { "channel": "visual", "description": "Always show context and cognitive mode" }
  ]
}
